{"$schema":"https://json-schema.org/draft/2020-12/schema","$id":"https://nexusomegac27.github.io/NEXUS-OMEGA-EVIDENCE/schema/scientific-communication-v1.schema.json","title":"NEXUS OMEGA Scientific Communication Record v1","type":"object","additionalProperties":false,"required":["schema_version","record_id","record_type","observed_at_utc","recorded_at_utc","actor_class","actor_asserted_identity","provider","transport_class","observability_class","receipt_assurance","scientific_relevance_class","privacy_class","claim_ceiling","claim_promotion","canonicalization_method","causal_parent_record_ids","completeness_status"],"properties":{"schema_version":{"const":"1.0.0"},"record_id":{"type":"string","pattern":"^[A-Za-z0-9._:-]{8,160}$"},"record_type":{"enum":["event","session","access_receipt","communication_receipt","claim_evidence_link","validation_receipt","correction","checkpoint","observability_snapshot"]},"observed_at_utc":{"type":"string","format":"date-time"},"recorded_at_utc":{"type":"string","format":"date-time"},"actor_class":{"enum":["HUMAN_OPERATOR","NEXUS_AI_ROLE","EXTERNAL_AI_AGENT","GITHUB_APP","API_CLIENT","CI_RUNNER","VALIDATOR","ANONYMOUS_PUBLIC_READER","THIRD_PARTY_RESEARCHER","UNKNOWN"]},"actor_asserted_identity":{"type":"string","maxLength":256},"actor_verified_identity":{"type":["string","null"],"maxLength":512},"provider":{"type":"string","maxLength":128},"transport_class":{"enum":["CHAT_UI","API","GITHUB","GIT","FILE_UPLOAD","OPERATOR_COPY_PASTE","CONTROLLED_GATEWAY","OTHER"]},"observability_class":{"enum":["OBS0_UNOBSERVABLE","OBS1_PROVIDER_AGGREGATE","OBS2_PROVIDER_EVENT","OBS3_MEDIATED_EVENT","OBS4_MUTUAL_RECEIPT"]},"receipt_assurance":{"enum":["RA0_NONE","RA1_SELF_ASSERTED","RA2_MUTUAL_BYTE_BOUND","RA3_AUTHENTICATED_PLATFORM","RA4_SIGNED_OR_TIMESTAMPED","RA5_EXTERNAL_TRANSPARENCY_WITNESS"]},"scientific_relevance_class":{"enum":["SR0_OPERATIONAL","SR1_PROVENANCE_SUPPORT","SR2_PROCESS_EVENT","SR3_CLAIM_EVIDENCE","SR4_GOVERNANCE_VALIDATION","SR5_SECURITY_INTEGRITY"]},"privacy_class":{"enum":["PUBLIC_FULL_TEXT","PUBLIC_REDACTED_TEXT","HASH_ONLY_PUBLIC_PRIVATE_PAYLOAD","METADATA_ONLY","WITHHELD"]},"claim_ceiling":{"const":"C1"},"claim_promotion":{"const":false},"content_sha256":{"anyOf":[{"type":"string","pattern":"^[0-9a-f]{64}$"},{"type":"null"}]},"content_bytes":{"anyOf":[{"type":"integer","minimum":0},{"type":"null"}]},"canonicalization_method":{"enum":["NONE","RFC8785_JCS"]},"causal_parent_record_ids":{"type":"array","items":{"type":"string"},"uniqueItems":true},"previous_record_sha256":{"anyOf":[{"type":"string","pattern":"^[0-9a-f]{64}$"},{"type":"null"}]},"external_witness_refs":{"type":"array","items":{"type":"string","format":"uri"},"uniqueItems":true},"completeness_status":{"enum":["COMPLETE","PARTIAL","TRUNCATED","SOURCE_NOT_PRESENT","NOT_OBSERVABLE","NOT_APPLICABLE"]},"uncertainty":{"type":"array","items":{"type":"string"},"uniqueItems":true},"event_type":{"enum":["SESSION_OPENED","SESSION_CLOSED","MANIFEST_FETCH","SOURCE_FETCH","ARTIFACT_READ","ARTIFACT_WRITE","PROMPT_SENT","RESPONSE_RECEIVED","VISIBLE_MESSAGE_EDITED","TOOL_CALL_REQUESTED","TOOL_CALL_COMPLETED","EXTERNAL_SEARCH","SOURCE_CITED","CLAIM_CREATED","CLAIM_REVISED","CLAIM_REJECTED","VALIDATION_STARTED","VALIDATION_COMPLETED","HANDOFF_CREATED","HANDOFF_CONSUMED","FILE_HASHED","FILE_EXPORTED","FILE_RECEIVED","REHASH_COMPLETED","COMMIT_CREATED","PR_CREATED","PR_REVIEWED","PR_MERGED","RELEASE_CREATED","EXTERNAL_WITNESS_CREATED","ACCESS_AGGREGATE_SNAPSHOT","OBSERVABILITY_GAP_RECORDED","CORRECTION_APPENDED"]},"source_locator":{"type":["string","null"],"maxLength":2048},"session_id":{"type":"string","minLength":8},"session_state":{"enum":["OPEN","CLOSED","PARTIAL","ABORTED"]},"participant_assertions":{"type":"array","items":{"type":"string"}},"access_target":{"type":"string","minLength":1},"access_mode":{"enum":["PUBLIC_BROWSER","RAW_FETCH","GIT_CLONE","GIT_FETCH","GITHUB_API","GITHUB_APP","GITHUB_PAGES","ISSUE_PR_INTERACTION","WEBHOOK","EXTERNAL_AI_CHAT_UI","EXTERNAL_AI_API","OPERATOR_COPY_PASTE","FILE_TRANSFER","CONTROLLED_GATEWAY","TRANSPARENCY_QUERY","ARCHIVE_ACCESS","OTHER"]},"actor_identified":{"type":"boolean"},"provider_aggregate_window_days":{"type":["integer","null"],"minimum":1},"receipt_subject_sha256":{"anyOf":[{"type":"string","pattern":"^[0-9a-f]{64}$"},{"type":"null"}]},"request_sha256":{"anyOf":[{"type":"string","pattern":"^[0-9a-f]{64}$"},{"type":"null"}]},"response_sha256":{"anyOf":[{"type":"string","pattern":"^[0-9a-f]{64}$"},{"type":"null"}]},"request_bytes":{"type":["integer","null"],"minimum":0},"response_bytes":{"type":["integer","null"],"minimum":0},"model_label_asserted":{"type":["string","null"],"maxLength":256},"truncation_status":{"enum":["NONE","REQUEST_TRUNCATED","RESPONSE_TRUNCATED","BOTH_TRUNCATED","UNKNOWN"]},"edit_status":{"enum":["UNEDITED","EDITED_VISIBLE","UNKNOWN"]},"attachment_sha256":{"type":"array","items":{"type":"string","pattern":"^[0-9a-f]{64}$"},"uniqueItems":true},"claim_id":{"type":"string","minLength":1},"evidence_record_ids":{"type":"array","minItems":1,"items":{"type":"string"},"uniqueItems":true},"claim_state":{"enum":["SUPPORTED","COUNTERED","MIXED","NOT_ESTABLISHED","NOT_COMPUTABLE","RETRACTED","SUPERSEDED"]},"directness":{"enum":["DIRECT","INDIRECT","MIXED"]},"caveats":{"type":"array","items":{"type":"string"}},"subject_record_ids":{"type":"array","minItems":1,"items":{"type":"string"},"uniqueItems":true},"validator_independence":{"enum":["SELF","SAME_ORGANIZATION","EXTERNAL_AGENT","EXTERNAL_HUMAN","UNKNOWN"]},"verdict":{"enum":["PASS","PASS_WITH_CAVEATS","FAIL_MAJOR","HARD_FAIL","NOT_ESTABLISHED","NOT_COMPUTABLE","SOURCE_NOT_PRESENT"]},"fixture_set_version":{"type":["string","null"]},"fixture_pass_count":{"type":["integer","null"],"minimum":0},"fixture_fail_count":{"type":["integer","null"],"minimum":0},"corrects_record_id":{"type":"string","minLength":1},"correction_reason":{"type":"string","minLength":1},"replacement_record_id":{"type":["string","null"]},"checkpoint_sequence":{"type":"integer","minimum":0},"record_count":{"type":"integer","minimum":0},"merkle_root_sha256":{"anyOf":[{"type":"string","pattern":"^[0-9a-f]{64}$"},{"type":"null"}]},"chain_head_sha256":{"anyOf":[{"type":"string","pattern":"^[0-9a-f]{64}$"},{"type":"null"}]},"provider_surface":{"type":"string","minLength":1},"metric_kind":{"enum":["VIEWS","UNIQUE_VISITORS","CLONES","UNIQUE_CLONERS","REFERRERS","POPULAR_CONTENT","OTHER"]},"window_start_utc":{"type":"string","format":"date-time"},"window_end_utc":{"type":"string","format":"date-time"},"aggregate_count":{"type":"integer","minimum":0},"unique_count":{"type":["integer","null"],"minimum":0},"individual_events_available":{"type":"boolean"}},"allOf":[{"if":{"properties":{"record_type":{"const":"event"}}},"then":{"required":["event_type","source_locator"]}},{"if":{"properties":{"record_type":{"const":"session"}}},"then":{"required":["session_id","session_state","participant_assertions"]}},{"if":{"properties":{"record_type":{"const":"access_receipt"}}},"then":{"required":["access_target","access_mode","actor_identified","provider_aggregate_window_days","receipt_subject_sha256"]}},{"if":{"properties":{"record_type":{"const":"communication_receipt"}}},"then":{"required":["session_id","request_sha256","response_sha256","request_bytes","response_bytes","model_label_asserted","truncation_status","edit_status","attachment_sha256"]}},{"if":{"properties":{"record_type":{"const":"claim_evidence_link"}}},"then":{"required":["claim_id","evidence_record_ids","claim_state","directness","caveats"]}},{"if":{"properties":{"record_type":{"const":"validation_receipt"}}},"then":{"required":["subject_record_ids","validator_independence","verdict","fixture_set_version","fixture_pass_count","fixture_fail_count"]}},{"if":{"properties":{"record_type":{"const":"correction"}}},"then":{"required":["corrects_record_id","correction_reason","replacement_record_id"]}},{"if":{"properties":{"record_type":{"const":"checkpoint"}}},"then":{"required":["checkpoint_sequence","record_count","merkle_root_sha256","chain_head_sha256"]}},{"if":{"properties":{"record_type":{"const":"observability_snapshot"}}},"then":{"required":["provider_surface","metric_kind","window_start_utc","window_end_utc","aggregate_count","unique_count","individual_events_available"]}}]}
