{"actor_asserted_identity":"github:web-flow","actor_class":"GITHUB_APP","actor_verified_identity":null,"canonicalization_method":"NONE","causal_parent_record_ids":[],"claim_ceiling":"C1","claim_promotion":false,"completeness_status":"COMPLETE","content_bytes":null,"content_sha256":null,"event_type":"PR_MERGED","external_witness_refs":[],"observability_class":"OBS2_PROVIDER_EVENT","observed_at_utc":"2026-08-30T23:46:29Z","previous_record_sha256":null,"privacy_class":"METADATA_ONLY","provider":"GitHub","receipt_assurance":"RA3_AUTHENTICATED_PLATFORM","record_id":"event:github-pr2-merge:20260830","record_type":"event","recorded_at_utc":"2026-08-30T23:46:30Z","schema_version":"1.0.0","scientific_relevance_class":"SR4_GOVERNANCE_VALIDATION","source_locator":"https://github.com/nexusomegac27/NEXUS-OMEGA-EVIDENCE/pull/2","transport_class":"GITHUB","uncertainty":["This record binds GitHub merge metadata only; it does not independently validate scientific content."]}
